{
  "workflow": "recherche-juridique-fr-avancee",
  "document_intake": {
    "document_id": "recherche-juridique-fr-avancee-case-002-document",
    "filename": "recherche-juridique-fr-avancee-case-002.md",
    "detected_type": "legal_research_question",
    "language": "fr",
    "legal_domain": "french_legal_research",
    "readability": {
      "status": "ok",
      "confidence": 0.86
    },
    "requires_human_triage": true
  },
  "draft_notice": "DRAFT - Validation professionnelle requise",
  "findings": [
    {
      "finding_id": "recherche-juridique-fr-avancee-case-002-finding-001",
      "title": "blocking_red_flag eval finding",
      "description": "Identifier un red flag bloquant et exiger revue avocat avant usage externe.",
      "document_reference": "recherche-juridique-fr-avancee-case-002-document",
      "source_citation": {
        "source_status": "official",
        "citation": "Fixture source for recherche-juridique-fr-avancee case-002",
        "url": "",
        "checked_with": "openlegi",
        "verification_note": "Identifier un red flag bloquant et exiger revue avocat avant usage externe."
      },
      "risk_score": {
        "severity": "blocking",
        "legal_impact": 5,
        "business_impact": 4,
        "probability": 4,
        "urgency": 5,
        "confidence": 0.86,
        "global_score": 8.5,
        "rationale": "Fixture case blocking_red_flag with official source status."
      },
      "audit_trail": {
        "finding_id": "recherche-juridique-fr-avancee-case-002-finding-001",
        "workflow": "recherche-juridique-fr-avancee",
        "document_id": "recherche-juridique-fr-avancee-case-002-document",
        "source_excerpt": "Clause manifestement sensible et source officielle disponible pour qualifier le risque.",
        "legal_source": {
          "source_status": "official",
          "citation": "Fixture source for recherche-juridique-fr-avancee case-002",
          "url": "",
          "checked_with": "openlegi",
          "verification_note": "Identifier un red flag bloquant et exiger revue avocat avant usage externe."
        },
        "agent": "recherche-juridique-fr-avancee",
        "reviewer": "legal-qa-reviewer",
        "confidence": 0.86,
        "human_validation": {
          "validated_by_human": false,
          "validator_role": "avocat ou juriste senior",
          "validation_required": true,
          "validation_reason": "Eval fixture only; external reliance requires professional validation."
        }
      }
    }
  ],
  "audit_trail": [
    {
      "finding_id": "recherche-juridique-fr-avancee-case-002-finding-001",
      "workflow": "recherche-juridique-fr-avancee",
      "document_id": "recherche-juridique-fr-avancee-case-002-document",
      "source_excerpt": "Clause manifestement sensible et source officielle disponible pour qualifier le risque.",
      "legal_source": {
        "source_status": "official",
        "citation": "Fixture source for recherche-juridique-fr-avancee case-002",
        "url": "",
        "checked_with": "openlegi",
        "verification_note": "Identifier un red flag bloquant et exiger revue avocat avant usage externe."
      },
      "agent": "recherche-juridique-fr-avancee",
      "reviewer": "legal-qa-reviewer",
      "confidence": 0.86,
      "human_validation": {
        "validated_by_human": false,
        "validator_role": "avocat ou juriste senior",
        "validation_required": true,
        "validation_reason": "Eval fixture only; external reliance requires professional validation."
      }
    }
  ],
  "human_validation": {
    "validated_by_human": false,
    "validator_role": "avocat ou juriste senior",
    "validation_required": true,
    "validation_reason": "Eval fixture only; external reliance requires professional validation."
  },
  "coverage": {
    "documents_seen": 1,
    "documents_processed": 1,
    "documents_unreadable": 0
  }
}
